<?xml version="1.0" encoding="UTF-8"?>
<xs:schema xmlns:xs="http://www.w3.org/2001/XMLSchema">
    <xs:element name="konyvek">
        <xs:complexType>
            <xs:sequence>
                <xs:element name="konyv">
                    <xs:complexType>
                        <xs:sequence>
                            <xs:element name="cim" type="xs:string" />
                            <xs:element name="szerzo" type="xs:string" />
                            <xs:element name="szereplo">
                                <xs:complexType>
                                    <xs:sequence>
                                        <xs:element name="nev" type="xs:string" />
                                        <xs:element name="baratja" type="xs:string" />
                                        <xs:element name="szuletett" type="xs:string" />
                                        <xs:element name="jellemzes" type="xs:string" />
                                    </xs:sequence>
                                </xs:complexType>
                            </xs:element>
                            <xs:element name="masikszereplo">
                                <xs:complexType>
                                    <xs:sequence>
                                        <xs:element name="nev" type="xs:string" />
                                        <xs:element name="szuletett" type="xs:string" />
                                        <xs:element name="jellemzes" type="xs:string" />
                                    </xs:sequence>
                                </xs:complexType>
                            </xs:element>
                        </xs:sequence>
						<xs:attribute type="xs:string" name="isbn"/>
                    </xs:complexType>
                </xs:element>
            </xs:sequence>
        </xs:complexType>
    </xs:element>
</xs:schema>